{
  "v": "v0",
  "intentId": "0x1111111111111111111111111111111111111111111111111111111111111111",
  "execRef": "mock-exec",
  "execRefHash": "0x2222222222222222222222222222222222222222222222222222222222222222",
  "success": true,
  "errorCode": 0,
  "stateHash": "0x0000000000000000000000000000000000000000000000000000000000000000",
  "resultPayload": "0x"
}